Advantage Capital Management,"Catalytic investments in underserved areas to boost economies, communities, and renewable energy solutions.",,https://climatebase.org/job/58242476/associate-compliance,https://www.linkedin.com/company/advantagecapital,https://climatebase.org/job/58242476/associate-compliance/careers,https://climatebase.org/job/58242476/associate-compliance/careers,https://climatebase.org/job/60236990/compliance-advisory-officer--energy--commodities?source=job_directory,"Compliance Advisory Officer – Energy & CommoditiesCompliance Advisory Officer – Energy & CommoditiesICAP Energy ASLondon, England, GBIn-personFull time roleDriving sustainable markets with innovative energy and commodities brokering.About 2 months ago",https://climatebase.org/job/61073002/compliance--support-analyst?source=job_directory,"Compliance  Support AnalystCompliance  Support AnalystWood MackenzieGurugram, HR, INIn-personFull time roleEmpowering smart climate and energy decisions through data and analytics.About 1 month ago",https://climatebase.org/job/61097613/compliance-administrator?source=job_directory,"Compliance AdministratorCompliance AdministratorAdvantage Capital ManagementNew Orleans, LA, USIn-personFull time roleCatalytic investments in underserved areas to boost economies, communities, and renewable energy solutions.2 months ago"
David Suzuki Foundation,"Protecting nature and fostering a sustainable Canada through research, education, and policy.",,https://davidsuzuki.org/,https://ca.linkedin.com/company/david-suzuki-foundation,https://davidsuzuki.org/careers/,https://careers.smartrecruiters.com/DavidSuzukiFoundation,,,,,,
Resource Environmental Solutions,Restoring ecosystems and sequestering carbon through nature-based infrastructure projects.,,https://res.us/,https://www.linkedin.com/company/res-us,https://res.us/careers,,,,,,,
Exponent,"Engineering and scientific consulting for safer, healthier, and more sustainable solutions globally.",,https://www.exponent.com/,https://www.linkedin.com/company/exponent,https://www.exponent.com/careers,,,,,,,
Context Labs,Accelerating global energy transition with trusted climate data and high-quality carbon credits.,,https://contextlabs.com/context-labs-announces-clear-path-platform-to-catalyze-change-in-environmental-commodities-markets/,https://www.linkedin.com/company/context-labs-bv,https://contextlabs.com/company/careers/,,https://contextlabs.bamboohr.com/jobs/,Explore Open Positions,https://contextlabs.bamboohr.com/jobs/,Explore all open positions,https://contextlabs.bamboohr.com/jobs/,Open Positions →
350.org,Global grassroots movement driving climate action in over 188 countries.,,https://350.org/?r=IN&c=AS,https://www.linkedin.com/company/350-org,https://350.org/?r=IN&c=AS/careers,,https://350.org/jobs/,Careers,,,,
Scope3,Eliminate climate risk with advanced emission reduction solutions.,,https://scope3.com/blog/category/company-news,https://uk.linkedin.com/company/edhec-climate-institute,,,,,,,,
Generate Capital,Delivering sustainable infrastructure to power and transform communities across North America.,,https://generatecapital.com/,https://www.linkedin.com/company/generatecapital,https://generatecapital.com/careers/,,,,,,,
Hydrosat,"Space-based thermal imagery for managing water stress, boosting food security, and protecting the environment.",,https://hydrosat.com/,https://lu.linkedin.com/company/hydrosat,,,,,,,,
Phaidra,"AI-driven control systems for industrial efficiency, reducing energy waste and environmental impact.",,https://www.phaidra.ai/,https://www.linkedin.com/company/phaidra-ai,https://www.phaidra.ai/careers,https://job-boards.greenhouse.io/phaidra,https://job-boards.greenhouse.io/phaidra/jobs/4593550005,Senior Account Executive (AI Factory Solutions)Remote,https://job-boards.greenhouse.io/phaidra/jobs/4493269005,Expression of Interest - EngineeringRemote,https://job-boards.greenhouse.io/phaidra/jobs/4493445005,Expression of Interest - GeneralRemote
Charge Point,Empowering widespread EV adoption with the world's largest open charging network.,,https://www.chargepoint.com/,https://www.linkedin.com/company/ourtreehousepro,https://www.chargepoint.com/careers,,,,,,,
Unison Infrastructure,Funding and managing sustainable infrastructure with $1.3B+ deployed since 2003.,,https://climatebase.org/company/1137534/unison-infrastructure,https://www.linkedin.com/company/unisoninfra,https://climatebase.org/company/1137534/unison-infrastructure/careers,,,,,,,
Last Energy,"Scaling micro nuclear to decarbonize energy and provide clean, affordable power globally.",,https://www.lastenergy.com/about,https://www.linkedin.com/company/lastenergy,,,,,,,,
Velo3D,Revolutionizing metal 3D printing for cleaner energy and efficient transportation.,,https://velo3d.com/sapphire/,https://www.linkedin.com/company/velo3d,https://velo3d.com/careers/,https://jobs.lever.co/velo3d,,,,,,
Sublime Systems,"Revolutionizing cement with zero-carbon, low-energy production for significant global emissions reduction.",,https://sublime-systems.com/,https://www.linkedin.com/company/sublime-cement,https://jobs.lever.co/SublimeSystems,,,,,,,
Brookfield Global Asset Management Limited,Investing globally in renewable power and infrastructure to support climate resilience and sustainability.,,https://climatebase.org/job/57676998/vpsvp-strategic-partnerships-global-client-group,https://ca.linkedin.com/company/brookfield,https://climatebase.org/job/57676998/vpsvp-strategic-partnerships-global-client-group/careers,https://climatebase.org/job/57676998/vpsvp-strategic-partnerships-global-client-group/careers,https://climatebase.org/job/60079942/vice-president--product-strategy--development?source=job_directory,"Vice President ~ Product Strategy & DevelopmentVice President ~ Product Strategy & DevelopmentBrookfield Global Asset Management LimitedNew York, NY, USRemoteFull time roleInvesting globally in renewable power and infrastructure to support climate resilience and sustainability.3 months ago",https://climatebase.org/job/60764199/senior-associate-regional-fundraise-management?source=job_directory,"Senior Associate, Regional Fundraise ManagementSenior Associate, Regional Fundraise ManagementBrookfield Global Asset Management LimitedLondon, England, GBHybrid, RemoteFull time roleInvesting globally in renewable power and infrastructure to support climate resilience and sustainability.2 months ago",https://climatebase.org/job/61265941/vice-president-product-strategy-development?source=job_directory,"Vice President, Product Strategy DevelopmentVice President, Product Strategy DevelopmentBrookfield Global Asset Management LimitedSingaporeIn-personFull time roleInvesting globally in renewable power and infrastructure to support climate resilience and sustainability.About 2 months ago"
Muon Space,Revolutionizing climate action with cutting-edge Earth-sensing satellite technology.,,https://www.muonspace.com/press/former-acting-deputy-secretary-of-defense-christine-fox-joins-muon-space-board,https://www.linkedin.com/company/spatial-informatics-group-natural-assets-laboratory,,https://job-boards.greenhouse.io/muonspace,https://job-boards.greenhouse.io/muonspace/jobs/4701745007,"Electrical Hardware Engineer (New Grad/Early Career)Mountain View, CA",https://job-boards.greenhouse.io/muonspace/jobs/4676930007,"Mechanical EngineerMountain View, CA",https://job-boards.greenhouse.io/muonspace/jobs/4815754007,"Spacecraft Structures AnalystMountain View, CA"
BorgWarner,"Driving carbon neutrality in automotive solutions for a cleaner, healthier, and safer future by 2035.",,https://www.borgwarner.com/company,https://www.linkedin.com/company/borgwarner,https://www.borgwarner.com/company/careers,,,,,,,
Fluence,Driving clean energy transition with scalable storage and AI-optimized management.,,https://fluenceenergy.com/,https://www.linkedin.com/company/fluenceenergy,https://fluenceenergy.com/careers,https://jobs.lever.co/fluence,,,,,,
Bidgely,Revolutionizing home energy savings with appliance-specific analytics to combat climate change.,,https://www.bidgely.com/,https://www.linkedin.com/company/bidgely,https://www.bidgely.com/careers/,,,,,,,
XENERGY,"Reinventing nuclear power for safe, affordable, and carbon-free energy.",,https://x-energy.com/media/news-releases/x-energy-uk-and-cavendish-nuclear-convene-british-suppliers-to-support-early-deployment-of-advanced-small-modular-reactors,https://www.linkedin.com/company/x-energy,,,,,,,,
Key Capture Energy,"Advancing large-scale energy storage for a stable, renewable-powered grid.",,https://keycaptureenergy.com/,https://www.linkedin.com/company/key-capture-energy,https://keycaptureenergy.com/careers/,,,,,,,
Sky Climber Renewables,"Driving renewable energy with comprehensive wind, solar, and battery solutions for a sustainable future.",,https://skyclimber-re.com/,https://www.linkedin.com/company/sky-climber-wind-solutions,https://skyclimber-re.com/careers/,,https://renewables-skyclimber.icims.com/jobs/intro,View Open Positions,https://renewables-skyclimber.icims.com/jobs/intro,View Open Positions,https://renewables-skyclimber.icims.com/jobs/intro,View Open Positions
World Wildlife Fund,United for a sustainable future through global conservation and innovative solutions.,,https://www.worldwildlife.org/,https://www.linkedin.com/company/world-wildlife-fund,https://www.worldwildlife.org/careers,https://careers.smartrecruiters.com/WorldWildlifeFundInc1/nambia,,,,,,
Enpowered,"Accelerating energy-saving solutions, reducing emissions, and promoting renewable energy adoption.",,https://enpowered.com/using-hydrogen-to-get-extra-value-from-clean-energy/,https://www.linkedin.com/company/empower-solar-energy-solutions,https://enpowered.com/company/careers/,,,,,,,
Power Factors,Accelerating the energy transition with software for optimizing renewable asset performance and collaboration.,,https://www.powerfactors.com/news/power-factors-to-accelerate-transition-to-clean-energy-with-aws,https://www.linkedin.com/company/power-factors-inc,,,,,,,,
Ecology Project International,Youth-driven conservation through local expert-student partnerships to protect threatened species and habitats.,,https://www.ecologyproject.org/,https://www.linkedin.com/company/cymgunep,https://www.ecologyproject.org/employment,,,,,,,
Enverus,"Accelerating investment in efficient, renewable energy development and distribution.",,https://www.enverus.com/,https://www.linkedin.com/company/enverus-energy,https://www.enverus.com/careers/,,,,,,,
FlexGen,"Advanced energy storage solutions reducing environmental impact with flexible, software-first technology.",,https://www.flexgen.com/,https://www.linkedin.com/company/flexgen,https://www.flexgen.com/careers,,,,,,,
The Aspen Institute,"Driving global climate solutions through dialogue, leadership, and impactful action.",,https://www.aspeninstitute.org/,https://www.linkedin.com/company/aspen-global-change-institute,https://www.aspeninstitute.org/about/our-careers/,,,,,,,
