Scope3,Eliminate climate risk with advanced emission reduction solutions.,,https://scope3.com/blog/category/company-news,https://uk.linkedin.com/company/edhec-climate-institute,,,,,,,,
Generate Capital,Delivering sustainable infrastructure to power and transform communities across North America.,,https://generatecapital.com/,https://www.linkedin.com/company/generatecapital,https://generatecapital.com/careers/,https://generatecapital.com/careers/,,,,,,
Hydrosat,"Space-based thermal imagery for managing water stress, boosting food security, and protecting the environment.",,https://hydrosat.com/,https://lu.linkedin.com/company/hydrosat,,,,,,,,
Phaidra,"AI-driven control systems for industrial efficiency, reducing energy waste and environmental impact.",,https://www.phaidra.ai/,https://www.linkedin.com/company/phaidra-ai,https://www.phaidra.ai/careers,https://www.phaidra.ai/careers,,,,,,
Charge Point,Empowering widespread EV adoption with the world's largest open charging network.,,https://www.chargepoint.com/,https://www.linkedin.com/company/ourtreehousepro,https://www.chargepoint.com/about/opportunities/staff-software-engineer-0?gh_jid=8055675002,https://www.chargepoint.com/about/opportunities/staff-software-engineer-0?change_location=1,,,,,,
Unison Infrastructure,Funding and managing sustainable infrastructure with $1.3B+ deployed since 2003.,,https://climatebase.org/company/1137534/unison-infrastructure,https://www.linkedin.com/company/unisoninfra,https://climatebase.org/company/1137534/unison-infrastructure/careers,https://climatebase.org/company/1137534/unison-infrastructure/careers,,,,,,
Last Energy,"Scaling micro nuclear to decarbonize energy and provide clean, affordable power globally.",,https://www.lastenergy.com/about,https://www.linkedin.com/company/lastenergy,,,,,,,,
Velo3D,Revolutionizing metal 3D printing for cleaner energy and efficient transportation.,,https://velo3d.com/sapphire/,https://www.linkedin.com/company/velo3d,https://velo3d.com/careers/,https://jobs.lever.co/velo3d,https://jobs.lever.co/velo3d/77b41278-15b6-480b-bb9b-cc1e199c6bbb,Senior Electrical Engineer,https://jobs.lever.co/velo3d/122e7abb-7610-4d44-bef7-115bf64ca4b4,Senior Mechanical Engineer,https://jobs.lever.co/velo3d/9383f5ae-c027-4fe8-90cb-8e667900895c,Manufacturing Engineer
Sublime Systems,"Revolutionizing cement with zero-carbon, low-energy production for significant global emissions reduction.",,https://sublime-systems.com/,https://www.linkedin.com/company/sublime-cement,https://jobs.lever.co/SublimeSystems,https://jobs.lever.co/SublimeSystems,https://jobs.lever.co/SublimeSystems/2e608cfc-faa8-455e-9c79-5c5f718cfff9,Head Of Partnership Development,https://jobs.lever.co/SublimeSystems/3b87ad64-4884-4852-b18f-3a1bb458b6e5,Process Engineer Ll,https://jobs.lever.co/SublimeSystems/e9e74bdb-4afe-43fe-85b6-7a4dfdef5a35,Pilot Plant Technician (2Nd Shift Position)
Brookfield Global Asset Management Limited,Investing globally in renewable power and infrastructure to support climate resilience and sustainability.,,https://climatebase.org/company/1136766/brookfield-global-asset-management-limited,https://ca.linkedin.com/company/brookfield,https://climatebase.org/company/1136766/brookfield-global-asset-management-limited/careers,https://climatebase.org/company/1136766/brookfield-global-asset-management-limited/careers,,,,,,
Muon Space,Revolutionizing climate action with cutting-edge Earth-sensing satellite technology.,,https://www.muonspace.com/press/former-acting-deputy-secretary-of-defense-christine-fox-joins-muon-space-board,https://uk.linkedin.com/company/stfc,,,,,,,,
BorgWarner,"Driving carbon neutrality in automotive solutions for a cleaner, healthier, and safer future by 2035.",,https://www.borgwarner.com/company,https://www.linkedin.com/company/borgwarner,https://www.borgwarner.com/company/careers,https://www.borgwarner.com/company/careers,,,,,,
Fluence,Driving clean energy transition with scalable storage and AI-optimized management.,,https://fluenceenergy.com/,https://www.linkedin.com/company/fluenceenergy,https://fluenceenergy.com/careers,https://bit.ly/3EWd8iO,,,,,,
Bidgely,Revolutionizing home energy savings with appliance-specific analytics to combat climate change.,,https://www.bidgely.com/,https://www.linkedin.com/company/bidgely,https://www.bidgely.com/careers/,https://www.bidgely.com/careers/,,,,,,
XENERGY,"Reinventing nuclear power for safe, affordable, and carbon-free energy.",,https://x-energy.com/media/news-releases/x-energy-uk-and-cavendish-nuclear-convene-british-suppliers-to-support-early-deployment-of-advanced-small-modular-reactors,https://www.linkedin.com/company/x-energy,,,,,,,,
Key Capture Energy,"Advancing large-scale energy storage for a stable, renewable-powered grid.",,https://keycaptureenergy.com/,https://www.linkedin.com/company/key-capture-energy,https://keycaptureenergy.com/careers/,https://keycaptureenergy.com/careers/,https://20230417161904_8clld49cklrdhnma.applytojob.com/apply/BOBxOpruL5/General-Resumes,Submit Your Resume And Cover Letter Here,https://20230417161904_8clld49cklrdhnma.applytojob.com/apply/BOBxOpruL5/General-Resumes,Submit Your Resume And Cover Letter Here,,
Sky Climber Renewables,"Driving renewable energy with comprehensive wind, solar, and battery solutions for a sustainable future.",,https://skyclimber-re.com/,https://www.linkedin.com/company/sky-climber-wind-solutions,https://skyclimber-re.com/careers/,https://renewables-skyclimber.icims.com/jobs/intro,,,,,,
World Wildlife Fund,United for a sustainable future through global conservation and innovative solutions.,,https://www.worldwildlife.org/,https://www.linkedin.com/company/world-wildlife-fund,,https://careers.smartrecruiters.com/WorldWildlifeFundInc1/nambia,https://jobs.smartrecruiters.com/WorldWildlifeFundInc1/744000075230100-integrated-development-planning-idp-manager-eu-nature-africa-program?trid=ef262718-79ec-40e6-83ea-758b8d96c645,Integrated Development Planning (Idp) Manager: Eu Nature Africa Programcontract,https://jobs.smartrecruiters.com/WorldWildlifeFundInc1/744000075230100-integrated-development-planning-idp-manager-eu-nature-africa-program?trid=ef262718-79ec-40e6-83ea-758b8d96c645,Integrated Development Planning (Idp) Manager: Eu Nature Africa Programcontract,https://jobs.smartrecruiters.com/WorldWildlifeFundInc1/744000075230100-integrated-development-planning-idp-manager-eu-nature-africa-program?trid=ef262718-79ec-40e6-83ea-758b8d96c645,Integrated Development Planning (Idp) Manager: Eu Nature Africa Programcontract
Enpowered,"Accelerating energy-saving solutions, reducing emissions, and promoting renewable energy adoption.",,https://enpowered.com/using-hydrogen-to-get-extra-value-from-clean-energy/,https://www.linkedin.com/company/empower-solar-energy-solutions,https://enpowered.com/company/careers/,https://enpowered.com/company/careers/,,,,,,
Power Factors,Accelerating the energy transition with software for optimizing renewable asset performance and collaboration.,,https://www.powerfactors.com/news/power-factors-to-accelerate-transition-to-clean-energy-with-aws,https://www.linkedin.com/company/power-factors-inc,,,,,,,,
Ecology Project International,Youth-driven conservation through local expert-student partnerships to protect threatened species and habitats.,,https://www.ecologyproject.org/,https://www.linkedin.com/company/cymgunep,https://www.ecologyproject.org/employment,https://www.ecologyproject.org/employment,,,,,,
Enverus,"Accelerating investment in efficient, renewable energy development and distribution.",,https://www.enverus.com/,https://www.linkedin.com/company/enverus-energy,https://www.enverus.com/careers/,https://www.enverus.com/careers/,,,,,,
FlexGen,"Advanced energy storage solutions reducing environmental impact with flexible, software-first technology.",,https://www.flexgen.com/,https://www.linkedin.com/company/flexgen,https://www.flexgen.com/careers,https://www.flexgen.com/careers,,,,,,
The Aspen Institute,"Driving global climate solutions through dialogue, leadership, and impactful action.",,https://www.aspeninstitute.org/,https://www.linkedin.com/company/aspen-global-change-institute,https://www.aspeninstitute.org/about/our-careers/,https://www.aspeninstitute.org/about/our-careers/career-opportunities/,,,,,,
